RD_ID,RD_MESSAGE,RD_SCORE,RD_VISIT_DATE
3148269,"Karon Beach was just a 7 minute walk from my hostel, and I went there every single day. It is WAAAAY less crowded than the popular Patong beach and way fewer people trying to sell you stuff, although there are some. There are a few restaurants right along the street, close enough to walk to and buy some food or nice, fruity drinks if you want some. I bought a coconut and inside was the strongest pina colada of my life, it was delicious. Mainly, this place is family friendly. I went by myself each day, no one bothered me and I saw a ton of people just enjoying themselves. Also, I mean LOOK at those pictures! The place is simply breathtaking!",5, February 2018
3148272,"Look, I see the appeal in parts. But from the majority of what I saw of Karon Beach, this is a dirty, unkempt beach area. We stayed across the street so it’s not like we didn’t see the beach. What I saw in large parts of the beach was trash, half-shanties, and one close encounter with a big rat. The few nicer areas brought this up to a three...just don’t come here expecting some pristine beach. The best way to enjoy it is to pick your spots carefully or enjoy the sunset from a nice bar overlooking the beach.",3, May 2018
3148273,I had a wonderful time... you can rent chairs on the beach... food vendors near... awesome time... no complaints,5, May 2018
3148274,Spent a couple of days on this beach as it was far less crowded than Patong beach. It has clean water and soft sand....could just do with a few more amenities!,4, May 2018
3148276,Beautiful beach with white send. Good restaurants are there near the beach where you can hangout. And this beach is near road side .,5, May 2018
3148277,"I love Karon compared to Kamala or Patong beach.It is peaceful there and the sand is pretty amazing. Sunset and sunrise must see! Although this area is quiet and less crowded like Patong, it is still walking distance to necessities like cheaper restaurants, 711, massage parlor, market. Kamala, although it is nice and quiet,  is way far and must take taxi to get to the main city. You'll always end up eating in the hotel.Strongly recommend Karon!",4, May 2018
3148278,Amazing beach Very clean and not much crowded good for families and couples to visit there are many activities available in beach boat ride etc.,5, May 2018
3148280,"Like this beach. Walking early morning catch the warm sea bath,wonderful warm sea in April.   Escape from cold weather from Edmonton , Canada.   We enjoys the beach,the sun, and get Tan for home.   At the beach we can excercise, Gym equipments on the side road near the beach.   We can use most of morning, It always too hot  at noon. There are play ground for children free to public.   I like the beach, we did not stay to see Sun Set,but the sun set into the sea.  The new project,will be safety camera on the beach.   I wish to visit this beach again.   You should visit,it is clean and safe. Enjoy The Sun and the Sand.",4, April 2018
3148281,Gorgeous white sand beach. Practically had it all to ourselves. Life savers had their flags up but ocean was quite calm. No one hassles you. Much more peaceful than Patong.Just a short stroll down the hill from our resort,4, May 2018
3148282,"Nice beach close to Karon Town. Lot's of activities on beach such as jetski hire, tubing, parasailing, massages.",5, April 2018
3148283,"Just stayed in Karon Beach, a lovely and quiet beach in Phuket with restaurant choices, shops and everything you need. Please however stay at the northern end where the small town is, as the beach is clean there. Unfortunately we took a walk all the way along the beach and half way down, the beach is just full of litter, it's EVERYWHERE and also in the sea. Why can't people take their litter with them or put it in a bin? It's unfortunately ruined half the beach so we turned back to our usual spot in the northern end! I'm assuming they only clean the northern end as it's where the town, and most of the hotels, are. A fun beach with big waves and soft sand, just choose the right end!!",4, May 2018
3148285,"I walked along this beach during my stay in the Karon area and have to say it was much quieter than Kata beach, although it could have been just a coincidence. Seemed pretty clean and the sand was lovely; wish I'd have had the chance to stay  around for longer, as there seemed to be a nice chilled out vibe to the place. Would definitely go back.",4, January 2018
3148286,I never seen so clean beach. Very quietbeach to relax and enjoying holiday no body coming to disturb no vender easy to hire chair and get local food that I love.,5, May 2018
3148288,"Great way to spend hours. Clean, and friendly area.100 baht pp for use of cushioned plastic sun lounge for the whole day.Public toilet opens around 9 or 10am...10 baht toilet, 20 for shower.Dont have towel?... we payed 500 baht for 2 brand spanker beach towels.",5, May 2018
3148289,"The beach was good ..clean but nothing special to talk about. Just any other city beach. I might be biased with krabi beaches that I visited before this . Kata might be a better choice ( I only visited patong, Karon and kata)",3, May 2018
3148291,"What a beach! We stayed near by at the old Phuket and walked down. It wasn’t ever too busy but was normally clean. We would rent umbrellas for 250 baht for the day for 2 of us. Lots of places to get drinks and food nearby. We would bring a cooler full of drinks and food and relax for the day. Beautiful sand and clear water. Been to several resorts throughout Mexico and the Caribbean, the water and sand was amazing",5, May 2018
3148294,Karon is ideally located. Plenty of shops and bar. Lots of places to eat and drink. Beach is lovely. Everywhere closes by midnight at this time if year. There are lots of bars with live bands. Karon holds a market on a Tuesday and Friday well worth a visit,4, May 2018
3148295,We had a very nice fewdaysrelaxing on the beach resort was nicethe swell can quite high the water was warm.,5, April 2018
3148297,"I went from Patong to the northern side of Karon Beach and I must admit I felt much better than at the former. Less crowded (albeit with decent amount of people), less touts, yet accessible shops and vendors for when you have that little craving.",4, February 2018
3148298,Excellent clean beach...calm waters very pleasant....long beach...lovely views....sum palm trees around for shade .Wil definitely go again...,5, March 2018
3148301,A quieter alternative to Patong Beach. Has quite a few stores and money exchange places bar far less than Patong beach. Quite a few popular resorts and hotels here.,4, May 2018
3148304,"Excellent time had by all 9 of us, plenty to do & see and the price is right. Food was fantastic and soooo many places to try. Excellent thumbs up",4, May 2018
3148306,"En mayo playa desierta prácticamente.Perfecta para huir de aglomeraciones. Sin ruidos de coches, sin música de bares...",5, May 2018
3148307,"Karon beach is one of the cleanest beaches we have come across in Thailand ,downside plenty of little bities in the water & Karon is overrun with Russians",4, April 2018
3148309,"Nice beach worth a visit we stayed in Karon for 17 days and only visited this beach twice, a lot nicer beaches in Phuket but this is not the worst, the sea is very choppy at times from what I seen and beds are 100 baht each which I think is reasonable",4, May 2018
3148311,The approach from the road is a bit littered. The beach is clean and doesn’t feel too crowded considering how long the beach is. Waves do get a bit rough. But fun!,4, April 2018
3148312,"Well this year was my second year in Karon, and going back next year. The Beach is one of the best around it's so long that there is plenty of room for everyone. The sunbeds were 200 Baht which is really not bad. Shops and hotels all near by and prices are really good, as are the people, but watch out because you will burn as the sun is so hot so careful just how long you want to stay 2 or 3 hours was enough for me.Gift shops. bars, ice cream are only minutes away taking a pushchair on to the beach is hard anywhere, but there are grass areas joining the beach",5, March 2018
3148313,"Pernoctaba en Patong , pero fue muy agradable ciertos desplazamientos a  KARON Beach , entre muchas cosas es menos agobiante que la vecuna playa de Patong y al mismo tiempo aconsejaria a todo viajero apersonarse a KARON  view point , las maravillosas vistas recompensan el viaje",4, April 2018
3148314,"some big breakers when we were there which enables us to do novice surfing, all the fun rides available the only problem was the toilet being a 500m walk and over the road",4, April 2018
3148315,"Stayed for 10 days, in the quiet season. Yes, it is quiet here, well, as quiet as it gets. Let’s just say I probably wouldn’t want to see the busy season.The beach at the Southern and Northern ends has some litter. We stayed in the middle and it was really pretty. Comparable to our beaches in Australia. There’s no surf to speak of, as in, Beach break. Very calm. I’d say the headland would be ok. If you want reasonably relaxing surroundings this is probably your best bet. Patong to the North was hectic as, Kata to the south was a nice beach as well but in my opinion not as nice. My advice is hire a bike, unlike Chiang Mai, things are pretty spread out here and your cheapest Tuk Tuk (which is actually a red cab) but they call it Tuk Tuk, is 200 baht l, a go, starting price. To get anywhere that is more than 1 kilometre starts to add up, like for instance, Patong 400 baht, Kata 300 baht, Phuket 700 baht. If you want a full on night life this is not your place. It is mainly filled with Russians whom the locals say, stay and drink in their hotel rooms mainly. We went out a fair bit and we were it. Karon just down the road is a little busier with a bit more night life.",4, May 2018
3148316,"We found Karon beach lovely for a swim or an evening walk, very close to a variety of restaurants and hotels.",5, April 2018
3148319,We have spent 6days here for our honeymoon. My husband and I love the beach it is so clean and great to swim.,5, May 2018
3148320,Karon beach is the best for relaxing and spending on a day time when sun shine. We have enjoyed our holidays in karon. We definily gonna come back again in karon for our next holiday.,5, May 2018
3148322,"Whilst staying in Karon we were pleasantly surprised that the beach is nice and quiet in comparison to Patong which was great for our two small kids. Granted, Patong is slightly better in terms of sand and water but overall we preferred the laid back aura at Karon. 100baht per sun bed and we were set for the day.",4, May 2018
3148323,"We had great fun on the beach and the water was so warm. Massage, restaurant, sunbeds and umbrellas available on beach with shops close by. We had great fun with our Lilo water bed and the sea was good with our grandchildren who are 12 and 9 years old. Felt very safe. Would recommend this beach for all ages.",4, April 2018
3148324,"I am a fan of beaches with white sand and crystal clear waters like the beaches in Ko Lipe, Thailand. I've seen beaches like this in England, and that's saying something! Busy beach. Golden sands. Parasailing. Restaurants bars and shops.",3, April 2018
3148325,"Love KaronIt's friendlyEasily accessible to various attractionsWalking distance to market s, pubs and restaurantsRecommended if you want a relaxed laid back holiday destination",5, May 2018
3148330,"Sandy beach with umbrellas and lounges for hire. Massages available on the beach semi private. The sand is fine and although no surf, it was very clean. Close to shops.",4, April 2018
3148331,"Karon, Kata and Kata Noi are my favourite beaches in Phuket.  All have beautiful soft sand and crystal blue water but Karon seems to be busier and the area isn't as clean as Kata and Kata Noi.  I didn't like the dirty little river feeding into the sea on the far left side of this beach.  It has lots of water sports and places to eat and drink.",4, April 2018
3148333,"Huge long lovely beach , sunbed 100 baht for the day , Great swimming , and life  guards to.There is some big waves which I had fun on but could be difficult for younger children",4, April 2018
3148336,Beautiful beach but FULL of tourists and very boring. Kata offers many more activities. If you like to just sunbath without much movement and close to bars it might be good for you.,3, April 2018
3148337,"Beach is lovely, not too crowded, sea lovely and warm but waves a bit strong at times, i am a non swimmer! Very family orientated.",4, April 2018
3148338,A great beach. Calm clear waters and endless options of food drink and accomodation nearby. The northern end has a great group of beachside restaurants with delicious cheap food. To the southern end is a rocky outcrop with good snorkelling too,5, April 2018
3148339,"What can I say, Karon Beach is great. Food options galore. Safe fir kids - you can rent a beach chair for 100 BHT. loved Karon beach",5, April 2018
3148340,"Unlike the beaches in Puerto Vallarta where there’s chairs, umbrellas and many of the hotels have there own section of beach to cater toward there customers Karon is a true beach. When we came it was not over crowded and the few vendors we saw are not overly pushy or aggressive. Para-sailing is available on the beach but most individuals either just sun bathe, walk the beach and or play in the water. A life guard is on duty depending on the section of beach you are on. Just pay attention and you will be fine. Oh yes last but not least  I know my hotel supplied us with Beach Towels I cannot say the same with the other resorts so it’s not a bad idea to pack your own just in case. Come see for yourself you won’t be disappointed.",5, April 2018
3148343,"We just  stayed in Karon Beach for 12 days. It was a great base for exploring the island of Phuket. The beach itself is long and wide with the water being mostly very calm, due to the bay it sits in. It wasn’t very busy when we were there which was also great. There are lots of restaurants along the beach both at the far end toward Patong, where we stayed and more centrally near Karon town.We stayed at the Novatel, Karon beach which was a very family oriented hotel. It’s across the road from the beach and a short walk into Karon. It’s also a 5-10 minute trip into much busier Patong.There are lots of great restaurants in town. Our favourite was Two Chefs, great food and lovely staff and management( they also make yummy cocktails!!!)You can catch a local bus from the main temple in Karon. For 40 baht it will take you all the way to Old Phuket town, the weekend night markets, Chalong Temple or one of the big shopping malls. A great bargain and a fun way to travel.So, Karon Beach is beautiful, the people are lovely, there’s great food and cheap massages( Apple Massage was my favourite)What’s not to love?  A great place to stay!️",4, April 2018
3148344,"Karon beach, the actual beach is beautiful. A good alternative to Patong. Good selection of hotels, resorts and restaurants. Good central location on the island.",3, April 2018
3148345,The best time to visit Karon Beach is the early mornings around 6:00 a.m. when there is very less crowed and only walking tourist all around. Sea is generally calm and no touts or sellers to disturb you. Sea beach is very clean and people enjoy swimming there. Great location in Phuket.,5, April 2018
3148346,"It baffles me when people say this beach is clean. No, it is not. It is not even close to clean. There are massive rivers and streams of poo (not treated) going into the ocean in both ends and that raw material is diluted (not much, unfortunately) in the water you are swimming. BUT, it is the cleanest I could find. It is big, it is almost beautiful, definitely not paradisiac (no such thing in Phuket). The water temperature is fantastic though.If you are going to south Phuket this is the beach to keep you happy, but if you are still undecided if Phuket is a good beach destination, don't go and save yourself from disappointment. Unless you are used to really rubbish beaches, Phuket will not add any value to a beach holiday.",3, March 2018
3148348,"Super promenade en bord de mer, shopping, cocktails et soleilOn y trouve de tout, plaisir de s y rendre en tuk tuk",4, February 2018
3148349,Love Beach like  to hangout  and Walk along the beach and sit. White sands clean and safe recommend for to go there,4, April 2018
3148351,"We walked along the beach early every morning before the heat got too stupid and just enjoyed being there. Lots of people had the same idea so there were good people watching options. The main one for us was watching people who had hired photographers flouncing around,go look and see.We were staying at the Beyond resort right at the end of the beach so didn't have to hire loungers etc,we enjoyed the beach without actually being on it during the day.I would say this is the best beach in the area.",5, March 2018
3148353,What a lovely place with a great clean beach and safe. The area is full of good quality hotels and lots of restaurants one of the best we found was Bai Toey which was good Thai cuisine between the Old Phuket Hotel and the beach on Karon road. Try it you won’t be disappointed. We ate there more than once and enjoyed it each time and that is very rare for us to return to the same place.,4, April 2018
3148354,"Great to visit, clean sand and very friendly people around. If you are in Phuket this is definitely a beach worth seeing.",4, April 2018
3148355,"Lovely beach and wasn’t too busy. Very clean although we struggled to find a bin! Last time I visited Karon was in June 2015, and I remember the water being extremely choppy and we weren’t allowed in the water due to the riptides. It wasn’t the case this time and the water water very calm. I guess it changes within the next few months",5, April 2018
3148356,"The beach wasn’t overly busy, on a 33 day. The water was beautiful and the lifeguards were on duty.",5, April 2018
3148357,"Much quieter and less hectic than Patong Beach. Not as many food shops and such, but not as many hawkers either.",4, February 2018
3148359,"this is a very beatiful and calm beach at the best cost of Phuket, I recommend it. There are good and no so expensive hotels in this place.",4, April 2018
3148362,"I used this beach very much because I stayed at the Hilton. Quiet, quiet and immaculate beach. the mess inside the city and the crowd does not exist here. Nature, sea and you. The water is sometimes very hot but clean and crystal clear. But when the beggining soma starts the tide, it goes back 90-100 meters and it gets a bit blurry.",5, April 2018
3148366,"With a distance like 15 mins away from central Patong, this is basically my most recommended beach in Phuket as not as crowded as other beach in this city. Clean beach, beautiful sunset and still a convenient location. Restaurants nearby and honestly. I will much prefer to stay in this beach more than the others.",5, April 2018
3148367,"While living in Singapore, Karon Beach became a destination of choice for relaxing long weekends.  Thought we would visit again after having left the regions a number of years ago.  We stayed at a local hotel but as we wandered the streets and enjoyed the beach we were overcome by the stench from the open sewers, annoyed by the crabby, rude, and downright impolite vendors and store clerks, the traffic was madness and the infrastructure was crumbling all around us.  All these changes made for a bad experience.  Not coming back to Phuket.",1, April 2018
3148368,"This beach is just beautiful, fine sand for miles and not too many boats to destroy the atmosphere.Could spend a week in the warm waters which are so clear.",5, April 2018
3148369,"We’ve been to Phuket many times for the past twelve years and Karon had always been our favourite beach. It is not as crowded as Patong, yet not too far away from the necessary amenities and good food. However, we are very disappointed that this trip since our last visit four years ago did not give us the same positive feelings about Thailand anymore. The influx of tourists from certain countries with many lacking in manners and consideration for others seems to have taken a toll on the locals. They have become less friendly and even rude to customers at times. We no longer experience the land of smiles, and customer service is poor if it exists at all. The infrastructure does not support the increase in the number of tourists visiting, and the whole place stunk like an open sewer. While we have met some friendly people this time, we are unlikely to visit this island again.",2, April 2018
3148371,Nice clean activity beach. Lots of safety regulations with the jet skis and paragliders. Lots of good restaurants too.,4, April 2018
3148373,"We had a great time in Phuket in March.  It was very hot, but was to be expected and was a welcome change from the weather in our home state of Michigan.  I would highly advise visiting this beautiful island.  We had an excursion every day and visited many locations on the main island as well as many small islands in the surrounding area.  I would not recommend this vacation for small children as the ones we saw seemed to be quite bored.  Teens would likely enjoy and of course adults.  The nightlife was amazing and much calmer than Patong.  So many places to see and eat great food.  Highly recommend!",5, March 2018
3148374,"Stayed for 10 days at Old Phuket Hotel, just off Karon beach.  The beach itself is lovely with soft white sand.  It was very hot in April but you can hire beach chairs (pair) for 200 baht (£5 approx.) which are well worth while.  The beach is long in nature but you are warned about rip tides on it and what to do.  There are the usual array of surf boats, jet skis and para-gliding to partake of.  A lovely beach to visit and about 400 yeards from our hotel.  There is also a corniche on it with stacks of small shops and restaurants.",5, April 2018
3148376,What a beautiful beach! A must visit place in Phuket! The water was not polluted as there were not many shops/stores/restaurants behind the beach. Unfortunately the red flag was raised that day and I haven't enjoyed swimming.,5, April 2018
3148377,Beach is nicer and less crowded than patong. White sand and there are water sea sport activities to choose from here as well,5, April 2018
3148378,The beach was stunning . Sun beds were 100bahts each plus a umbrella. The sea was sometimes choppy . It was nice to go and have a dip when the weather was so hot.There was a lot of sellers up and down selling anything from ice lolly’s to hammocks. After a few hours it got on your nerves. There was supermarkets over the road if you needed refreshments.,5, March 2018
3148383,"Beautiful beach, gets quite busy but it is lovely. Arrive early to beat the crowds. Right in the town with lots to see and do.",4, April 2018
3148384,Really nice and less crowded than Paring. Water is warm. Across from Hilton hotel. Not too many fish but the water is clear.,5, April 2018
3148388,"We didn’t use this beach a great deal as our hotel had a lovely pool area but it is a great place. It has something for everyone and whether it is lone travellers, couples or families with children there is lots to do.The beach itself is lovely white sand and it’s nice to walk along if you want some exercise. There are lots of shops, bars and restaurants along the way and sunbeds with umbrellas can be rented cheaply.",5, April 2018
3148389,Karon beach is pretty busy but a lovelt long stretch of clean sand. There are lots of water sports going on. There are some sun lounger but most people just lay on the sand. The sea can be quite rough and we were bitten a lot by sea mites while swimming.,4, April 2018
3148391,"Value for money, professional  friendly and prompt service, amazing shirts and other garments purchased from Sam at a very reasonable price. All ways has the products ready when promised and have never had any comebacks",5, April 2018
3148392,"Clean beach, less crowded/dirty than Patong Beach. The water was clean, however I was expecting crystal clear blue water with warm sand, and none of the beaches on Phuket really offer that.",3, January 2018
3148394,Early morning this beach is amazing but by 10am it's very busy . The sand is so fine it squeaks when you walk on it .plenty of Sunbeds to rent 200bht.a day. & the rocky area behind the beyond hotel provides good snorkelling with many different colourful fish to see.,4, April 2018
3148396,Karon beach is very big beach with very good views  ok for swimming etc..mostly crowded  but since its big it accomadates  2 beds .  1Umbrella u can get on beach which is a standard price in Phuket..,4, March 2018
3148399,Much nicer than Patong because it’s not crowded. The food here is also delicious. I felt safer walking around at night. The small shops in the plaza were nice. Overall a great beach!,5, April 2018
3148400,best beach in terms of location and connectivity. just 20 minutes away by bike from the patong beach.,5, March 2018
3148401,"Karon Beach , lovely place to visit , night markets near beach are awesome , restaurants and food in Karon are great , bars are good and friendly people , the Thai people make you welcome and never stop smiling",5, April 2018
