RD_ID,RD_MESSAGE,RD_SCORE,RD_VISIT_DATE
3147968,"Visited beach before,June/July,all debris from storms in those months removes from beach.Sunbeds  and Brolley 200 bhts for the day £5.00.resturants only 60 yds from beach.beach cleared of rubbish every night,keep fit gym equipment available at both ends of beach.",5, November 2018
3147969,Nice beach and for 100 Bhat a bed you can’t complain!A good and friendly vibe and the beach and sea are gorgeous!,4, November 2018
3147970,"So clean, quieter than patong. We stayed in Novotel Karon which was awesome on its own.. Their facilities are excellent... Loved it.",5, November 2018
3147974,"Clean water,awesome parasailing, not crowded, very peaceful environment. This beach is surrounded by very good beach wear shops . Must do shopping here as same stuff is very reasonably priced compared to other beaches of Phuket",5, November 2018
3147975,"This beach was alot of fun, staying at Movenpik we visited several times. The beach is white sand and quite shallow.Down one end are rows and rows of deck chairs, in the middle are beach volley ball nets, and the furthest other end are rocks that you can climb on (a few metes high so not dangerous). You can higher jet skis (its hilarious watching a little bike pulling off these at the end of the day) and parasailing (both single and tandem). Cost of parasailing was about 300 baht for 2 of us. Plenty of food, shops, markets, taxis all along the beach front.",5, April 2018
3147979,"This beach is highly recommended. This beach is clean and the views are beautiful.  If in phuket, I would highly recommend Karon or Kata.",4, November 2018
3147980,3 of us stayed in the middle of karon beach 10 mins in each direction and your pretty well. Covered. Plenty of bars restaurants and places to buy your bits and bobs. The beach is long and the sand is fine. It's close enough to patong without being in the mix and madness that comes along with it.,4, November 2018
3147981,"Karon beach was cross the road from our hotel. Clean water and sandy beach, no rocks under your feet which was beautiful to walk on. The under water photo was about 20 meters from beach and 2-3 meters deep. I went around 12, nice waves to swim in. The water was very clean no seaweed or fish, just clear sand. Excellent to practice snorkelling. There are a number of restaurants nearby for drinks or lunch. There is also a nigh market near the lake, selling pancakes, fried ice cream, fruits and fried bugs. Different beach to Patong, more space and less commercialised.",5, November 2018
3147984,This is a gorgeous beach where you quickly feel like a local living in paradise. The water is clear and clean. It is small enough to not feel overwhelmed by the crowds but large enough to have all the choice of activities,5, November 2018
3147985,A really inviting beach to visit. The water is warm and clear. Take mask and snorkel lots of things to see under the sea,5, November 2018
3147987,Good beach with a decent swell of waves to make it fun. Not a lot of things in the water pretty much just sand. Nice sunsets too.,5, November 2018
3147988,"Very clean and nice beach, water looks crystal clear and blue, I am so impressed, lovely. Amazing ...",5, November 2018
3147989,"I guess this one of the top three beach’s in Phuket, very clean and safe, didn’t see any jellyfish at all and it can be used for surfing (beginner), lots of great restaurants along the beach road and for me it was the best sea food restaurant compared to Patong and Kamala in both quality and Price wise.",5, November 2018
3147991,"First things first its hot so sun block is a must even for dark skinned people. you will thank me later believe me . always make sure to take a back pack with water ,sun block and a cap .the back pack is for carry you food ,drinks and towel to the beach and in case you buy any new stuff its just easier than carrying lots of small packets...make sure to choose a nice spot on the beach with deckchairs it makes a differences. the sandy shore is so nice and the water is warm with decent gentle waves perfect for swimming...make sure to stay hydrated, street food and stalls and shop a close by . will definitely return again.",5, October 2018
3147994,"Very busy, deckchairs and parasols all along the beach. Sand pathway along the top was a bit grubby. Nice to feel the sand between your toes then head back to the hotel for a swim!",3, November 2018
3147996,"When me and my family go to the beach they’d all go to the beach and I’d walk off to the nearest headland to practice my bagpipes. My wife is a beach widow!Then things have changed. I first came to Karon beach, almost as a random choice. I’ve had a ‘Damascus Road’ experience.Today I bought a dry bag from the local shop. Stuffed my clothes in the bag and swam the whole length of the beach towing my stuff behind. This is the third day running.It’s a popular venue but there’s enough space to get some quiet. Long white sand which crunches under your feet like the sound of flour or custard being pressed, clear lapping water, water sports, beach massage, cheap food, very little loud music, family friendly... need a say more!And then there’s the sunsets. I think the Creator tripped up when making the sunsets here and left a large dollop of his (or her) glory. Every evening I’ve sat on the sand and been awed by the west facing view of the closing day. It’s a must for your trip, and a free show. First time I saw it there were tears in my eyes.However, be aware of a couple of thingsFirstly the beach road is busy, so kids particularly will need watching.Secondly, the largest proportion of visitor seems to be Russian.They’re friendly enough but it was another significant culture to get the measure of on my holiday. I’ve found myself latching onto every English speaking conversation I can.So. Please don’t tell anyone about this place, we don’t want too many people to share it with us. The bagpipes have failed to make an appearance and I’m writing this review with crinkled fingers from too much water!",5, November 2018
3147998,"Karon Beach features the third-longest beach on Phuket Island. Located on the west coast, between Patong to the north and Kata to the south, Karon Beach is the one of the most popular holiday destinations in Phuket. The beach itself has excellent snorkelling (and even diving) spots at its southern end and is wide enough for beachgoers to never feel crowded.",5, October 2018
3147999,"Karon Beach itself was a place where I just found myself soaking up the sun & just doing absolutely nothing for hours at a time. To be able to waste away the day looking at the ocean or swimming in it, was what I found to be so relaxing & helped to forget about my everyday life back home.",4, October 2018
3148000,"Not as busy as expected and plenty sunbeds/umbrellas available.  Staff were very helpful in obtaining extra beds when required.Great fun dodging the waves in the water, but not for the faint hearted.  I would imagine this can be quite dangerous on some occasions.",5, October 2018
3148005,Staying at Kata but wondered out for the day.To hot to sunbathe so walked along the waters edge.A beautiful and quiet beach. The sun loungers and shade were 100b each. A bit dear if you are only planning on staying for an hour or so.Enjoyed our afternoon,5, November 2018
3148009,"Wenn wir in Thailand sind, verbringen wir 70% unserer Beachzeit auf dem Karon Beach.Dadurch das er so lang ist findet man immer ein ruhigen Platz.Und das Knirschen des Sandes unter den Füssen ist einmallig:)))))",5, January 2018
3148011,"Karon beach is a very nice and clean beach. best place to spend the evening. For those who don't like the crowded patong beach, karon offers the best option.Lots of drinking and eating option nearby",4, January 2018
3148012,Would recommend this Resort to Families. Great Food and very friendly staff. Rooms were clean and spacious.Thanks,5, October 2018
3148013,"It is more comfy compared to Phuket Beach for me who prefer beach which are have quiet and calm atmosphere, no enterance ticket, white sand, and good people.",4, June 2018
3148014,We were stayin at central villa s but used facilities at sister hotel central grand which is on the beautiful Karon beach with clear warm sea and waves lapping the shoreline fantastic,4, October 2018
3148016,Lovely beach. It was very busy. One cannot underestimate the rip currents even though the sea looks calm. One can spend a relaxing day on a beach loungers offered for 100 baht each. Jetskis can be hired and you can go parasailing. Out hotel was across the road from the beach which was very convenient,4, October 2018
3148017,bit choppy but if walk further on really nice and calm watching lizards coming out of trees eating crabs of the rocks would deffo hire a bed as sand has a lot of flies but really enjoyed it sea is like a warm bath loved it,5, October 2018
3148019,Walked down to Karon Beach from our hotel and just took in the sunsets every night. Some lovely scenes as you watch the sun go down and then see the sky light up in orange and red colours.,4, October 2018
3148020,"We have been to Phuket 5 times and stayed at Karon Beach every time.  It's been about 3 years since our last trip but it seems to have gone downhill and become a bit more daggy and cheap.Other beach areas seems to have added some nicer places in terms of food, massage and other things but Karon just has added not much and what's new is just more cheap food places and daggy looking massage shops.  Having said that there are a couple good places to eat and fantastic resorts.There are nice beaches and it's small and easy to walk around.  It's a fun place like most of these beach areas but I wouldn't go back there .. If you haven't been there it's worth a try, just not for us.",3, October 2018
3148021,"It's such a clean, nice beach . We had an amazing time here. One of the very few beaches where I really enjoyed being present.",5, October 2018
3148022,Karon beach was right across the road from the Movenpick resort. It is not crowded and many families were enjoying the water. Parasailing is available and other activities. The beach was clean and not too busy.,4, October 2018
3148023,There are basically no restaurants or hotels directly in the beach so it look wild and is peaceful. It's a great place to go for relax.,5, October 2018
3148024,"With the temperature in the high twenties, humidity in the 70s, warm water and quiet, clean beaches, the northern end of Karol Beach is ideal in the early morning. The many Russian families with young children bear testimony to the calm, safe conditions that can prevail. We have breakfast early (before 7h30), then head down in the coolness of the morning. As most businesses only open at 9 or 10, the beach, like the village, is very peaceful before 10. Ideal for a beach stroll to the southern end and refreshing dips along the way should you need it.",5, October 2018
3148025,"This is a near 'pristine' beach. We visited both Kata and  Karon beach and have to say Karon was much quieter than Kata beach, although it could have been just a coincidence. The beach was pretty clean and the sand was lovely. Compared to Patong Beach, I would say Karon beach trumps. Would definitely go back",5, August 2018
3148027,"Lovely beach, lots of activities available. Beautiful sunsets, makes for a good photo opportunity. Could have more bins.",5, October 2018
3148028,Thai best tailor in karon beach phuket is Tony and Raj at malla tailors very friendly and helpful great experience,5, October 2018
3148031,"This beach is perfect for a long early morning walk.   It’s a lot better then kata beach and cleaner. Best time is to walk at 6am before it gets hot and busy.The local government need to put more bins and ensure regular cleaning,Tourists need to also be respectful and thrown rubbish away in bins or take back to hotel to dispose of.",5, October 2018
3148032,"very nice and long gold beach ,with a lot of restaurants in front of the beach,you can see a lot of   people in beach  .when you walking on the sand ,you can hear snow sounds under your walking,,",4, July 2018
3148035,"Karon beach was disappointing for the simple fact that it was very dirty. Not sure where the trash comes from, I am assuming from being washed up on shore. Nonetheless, it was a challenge to find a “good” spot to lay down as I didn’t feel comfortable surrounded by so much garbage.Has potential to be a great beach, but I’d be hard pressed to find anyone who would argue Karon beach is clean.",2, October 2018
3148042,"Firstly I am spoiled with some beautiful striden beaches where I live, however karon Beach is a pleasant stretch of Beach which is scattered with palm trees and other local trees.There are areas with seating and umbrellas and the water is a constant warm temperature.As the sun goes down you can get some spectacular photographs of some beautiful sunsets.",3, October 2018
3148043,Ideal for walks and swimming. Water sports also done in the central and end section but plenty of area for any type of activity,5, October 2018
3148044,"This beach is polluted. There are plastic bottles / plastic bags / sigarette buds everywhere and a lot of trash washes up by the tides. It was really disheartening to see this (and people were adding to it by leaving their trash on the beach). Lots of activities to do (for a price of course) like banana boat, jetski, parasailing, etc. There are also vendors but they don't really push you to buy something.",3, October 2018
3148046,Definitely one of the more quiet beach optios in Phuket. Plenty of restaurants and markets as well as a children's play area with swings and slides. Many salons offering Thai massage and mani-pedis. Parasailing available from the beach.,5, October 2018
3148047,"Love Phuket, but most of all love Karon beach people around are so friendly too. Definitely come back again",5, October 2018
3148048,"Estuvimos alojados en Karon Beach, pero nuestra estancia no era para pasar días de playa, sino para disfrutar de Phuket y sus alrededores. La playa es bonita, amplia (2,5 kilómetros de longitud) pero con el hándicap de que casi siempre tiene unas condiciones de baño complicadas…",3, July 2018
3148053,nice beach full of activities Parasailing lots people swimming  sunbathing  just need to swim between flags,4, October 2018
3148054,"The beach is nice, easy to walk to shops, restaurants, massages etc. Chairs and umbrellas available...I think for a cost.",5, October 2018
3148055,No one to disturb you trying to sell stuff. Work your tan just loke the rest of the mini crowd and absolutely clean beach.,5, October 2018
3148057,Karon beach is quiet and peaceful. Not a lot of people around at this time of year. Some great food places and massage places Altho many not willing to barter on price. Not sure if because it was low season. 400 baht one way to Patong which eats into your budget if you want to go there often,4, October 2018
3148062,We popped by for awhile in the late morning and early afternoon and it was packed. Karon was one of the popular beaches in Phuket but certainly better than Patong beach in many levels. We went back again during sunset and it was beautiful.,4, September 2018
3148065,Nice place to go for beach swimming as the sea is flat unlike other beach in Phuket. And the beach is so long. Along the way there are many restaurants by the beach.,5, October 2018
3148066,"I spent two weeks at Karon Beach, staying at Best Western. It's a beautiful time of year, the monsoon season has finished with just a few days of clouds and tropical showers and many beautiful sunny days at the perfect temperature. There are many good places to eat, the Temple Market to visit, the big Buddha is close by.The beach itself is beautiful with many nationalities enjoying the sun and Para Gliding from the sand. Swim between the flags as there are many rips that occur quickly as the sand banks change.",4, September 2018
3148067,"Karon beach is underrated by many. Beautiful white sand beach that stretches for kilometers. Popular during June, July, and August. Good restaurants and markets. Watersports for great views.",4, September 2018
3148069,"A beautiful beach with lots of activities for all ages.  The water is pristine and the beach is clear of plastics and pollutions.Usual Thai sellers of massage, henna, braids and beer available. Really worth going to.",4, September 2018
3148070,"The beach was lovely, but I got bitten or stung by something, all over my chest and tummy.I broke out in an irritating, nasty rash the next day.",4, September 2018
3148071,"Dirty full of rubbish,  very disappointing. Would not go again. The town wasn't mucn better either, dirty place.",1, September 2018
3148072,Beautiful beach in Karon. The beach is very well kept and clean. Many shops and restaurants within walking distance.,5, August 2018
3148073,"This is easily the best beach we went to on our trip. Clean, well looked after, and didn't have 300 boats crowding the water. We didn't have to swim in designated blocks either. Highly recommend this!",5, May 2018
3148074,"We stayed across the road and I tried to swim st beach daily.The Beach is clean with fine sand and the water was clean ad well.It had lifeguards with swim areas that were clearly marked with flags, but I chose to swim outside the flags without any problems. A nice beach away from the crowds of Patong beach.Also had pay for use beach chairs.",5, September 2018
3148076,"We stayed in Kata but went to Karon beach many times , just like Kata beach they are clean and worth the walk",5, August 2018
3148078,"I stayed at Mandarava Resort and Spa. I bit far from shopping area - 15 mins walk!! to the city of Karon Beach.  Good though after massive food.Nice beach. Something stung me when I swam at the beach.  It is a bit annoying.Lots of local food, and BBQ my favourite!",5, September 2018
3148079,One of Phuket's nicer beaches.Popular with Russians.I enjoyed swimming here every day. Easy access and it even had an outdoor exercise area. It had lifesavers patrolling the beach but I had reservations if they were qualified.Jetskiing and parasailing are on offer. The beach & ocean was clean unlike with many beaches in Asia today.,4, September 2018
3148081,Had a WONDERFUL day here today. Not too crowded. Nice clean beach. Vendors renting lounges for about $3 US each including umbrella. Cold drinks nearby. Massage ladies here were fantastic!  1 hour massage for 400 Baht ($12 US)  definitely recommend.,5, September 2018
3148084,"Had a great time relaxing and sightseeing, Karon beach is a good spot with plenty of restaraunts, shopping and bars.Easy access to a lot of tourist things. great area to stay.",4, September 2018
3148085,I did my morning beach runs here and it was a beautiful beach! Enjoyed it very much. Amazing statue and very close to where I was staying in Kata,5, September 2018
3148086,"Karon Beach Area is a lovely spot, with lots of markets and restaurants, everything is in walking distance, great holiday spot",5, September 2018
3148089,"Karon Beach is a beautiful area, and is a lot quieter than it's neighbouring Patong.Huge selection of hotels and restaurants. Great for the family.",5, September 2018
3148090,Karon Beach is quieter than Patong.  The red flags are up this time of year due to rough seas which can quickly change for the worse when rain fronts come through.  Did not see any lifeguards on duty which didn't worry some from taking a dip.,4, September 2018
3148091,Love the beach at karon as compared to Patong or Kata. Much quiet for a beach holiday. Sand is clean and make sure you book hotels opposite beach so is easier to access the beach,4, September 2018
3148093,"Karon Beach is typically not as popular as Kata Beach, for example, because of the rip tides and the fact that it is a lot rougher. However, if a not-so-busy beach is your thing and you prefer to bodysurf a few waves rather than swim at a beach where there is hardly any movement in the water, then Karon Beach is your spot!More than enough life guards on duty who keep a close and active eye on bathers, blowing their whistles when anyone drifts outside of the flags.It was our favourite beach at Phuket.",4, September 2018
3148096,"My husband and I while walking along the beach front shops of Karon was pulled aside by a man with a stall selling clothing and the back of his shop lead out to a dam where you can go with your child or self and catch and release fish.The entrance was very ordinary, I would say work in progress. We were asked to follow further and were shown tanks with large fish in them that are in the dam you could possibly catch.Then handed a brochure no business name anywhere or signs as such which I have taken a photo of. Photos of Fathers and son holding caught fish.Map on the back and phone number on front.Needing a lot of work maybe good if desperate to fish on a budget.Worth a visit if you have children Definately not as glamorous as the flyer.But share just the same.",2, September 2018
3148097,"I would recommend staying here if you want a quiet beach holiday, enough going on to keep me happy, not as crazy as Patong beach by any means.  The sand and swimming are great.",5, May 2018
3148102,Great Indian restaurant in Phuket town just off Bangla roadGreat variety of Indian dishes with a great taste and low price.  Pleasant customer service who are willing to cook to your taste like excluding onion and garlic of their dishes to make them for Jain Indian eating.,5, August 2018
3148103,My husband and I are staying in a resort hotel across the road Karon Beach. Karon Beach has a long expand of beach with the usual umbrellas etc. Good for swimming or just flexing out. Approx 20 mins by car to Patong. A more relaxed and friendly atmosphere. We are active senior travellers.,4, September 2018
3148104,Quieter side of Phuket but ideal for holiday. We really enjoyed our stay - people are super friendly. Great for people wanting a beach resort holiday. Highly geared for tourists. Suggest you look for the bars/food stalls etc off the beaten track.,5, September 2018
3148105,We arrived from krabi by mini van .. they asked for extra mony to drop us at the hotel and when we refused the drop us at the karon center .. tuk tuk and taxi advantage coz of the luggage ..  and they raised the price they asked for 200 baht for two minutes drive to hotel ..,2, September 2018
3148106,Karon is nice. not as crowed as Patong. still it has rubbish everywhere on beach as it is wet season. warning if riding scooter - make sure you have internstional drivers licence and wearing helmet as you will be pulled over by police. if u dont have licence and helmet u will be fined. also be prepared for bag search.,4, September 2018
3148108,We have been to Thailand several times and always choose to stay at Karon Beach as it is not the hustle and bustle like Patong is. The beach is not over crowded plenty of room and an pleasant walk. Only have to cross the road for shopping and places to eat also there are places along the beach area to rest and enjoy the view.,5, April 2018
3148112,"we were just on the beach a couple of times but it is really nice,you have to rent your sunbed(a couple of pound) and bring your own towel but we found it worth while you do get bothered by street vender,s but a polite no is enough,you can only swim in between certain flags because of the tidal current but it is patrolled at all times by lifeguards",5, August 2018
3148114,"The worst thing that happened to Karon Beach in recent years was the removal of the beach chairs and umbrellas, this left beach goers with no shelter and removed a basic reason to go to the beach, There is nothing more pleasant than lounging on a sunlounge under an umbrella, and an occasional dip in the tepid tropical waters. Karon beach is fabulous, fine wide sand turquoise water and it is never crowded as it is so long. However the beach chairs are back, In my estimation they were gone for about 3 years, but at the end of August 2018 they were there.. For 100b around $4 AUD or $3 USD you get to use one for all day, I believe karon is one of the better beaches in the world and it is a personal favorite of mine. The water is clean, the foreshore is not too bad although not totally pristine and it is easy to access.",5, August 2018
3148115,Even had massages on the beach! Plenty to do but not so good for swimming. Windsurfing was flat out with 3 boats going all the time,5, August 2018
3148116,The town of Karon is geared for tourists and we were there in low season. We headed to Kata beach for some quiet but were touted constantly whilst there. There's great night markets on Tuesday and Friday nights with food stalls and loads of everything else.,2, September 2018
3148117,"Relatively nice beach. Cleaner and less crowded than Patong beach. Less peddlers harassing you by selling items.Along the stretch of beach, the other side of the road is lined with stores selling food and items, as well as resorts.",4, August 2018
