RD_ID,RD_MESSAGE,RD_SCORE,RD_VISIT_DATE
3147113,"Lovely golden sand, clear water,,,,a nice stroll with our dog in the evening...alot of businessees close by are closed unfortunately, but we hoping this will change soon",5, June 2020
3147115,Well today was a nice day for a change and as the rain had stopped I decided to go down to Karon beach .It was nice to see the beach in its natural glory.As currently you can not enter the beach,5, January 2018
3147116,"One of the longest and widest beach on these parts, gentle sloping and usually crowded during Peak season as there's quite a line 4 to 5 stars hotels lining the beach. Though being a long beach, there's usually room for all. Low season this beach sees the largest waves, thus attracting some surfers. There used to be a surf competition every August. Swimmers might want to take note this is quite a dangerous beach during low season and usually there's a warning red flag. Great for walks or simply chill on the beach",4, March 2020
3147122,March good time to go as seawater not too rough.Water is beautiful & warm.100baht for bed & umbrella well needed in 32-36 temp.Drinks available on beach.,5, March 2020
3147123,The big question when you visit Phuket is... Patong beach or Karon beach? Personally I prefered Karon - it has such a lovely long stretch of sand with palm trees across it and is generally quieter. Sunbeds are 200 baht for a day (including 2 adjacent sunbeds with an umbrella).,5, March 2020
3147125,i love this beach... its so wide...its good for jogging..more than 3kilometer long. and water is good also,5, March 2020
3147127,"Excellent beach, very quiet and plenty of space between visitors.The sand is very soft and the water is very clean",5, March 2020
3147135,"visit almost south end of the beach, they had little bar an sunbeds for rent there. great service at bar. Too hot to stay more than two ours",4, March 2020
3147136,u can see this beach while visiting Karon viewpoint. good one. clean and well maintained. i visited in during the sun set time.,4, June 2019
3147137,Very beautiful resort. Located on beach near a cove. You can snorkel right off the beach. The restaurant have great food with different varieties. The pool area has options for couples only or with kids with slides and lazy river. I had ordered a private dinner on the beach right at sunset. It was an amazing experience. Our server Dear made it even more pleasant and memorable. We had a blast at this hotel. We definitely will be back. Thank you much!,5, March 2020
3147139,"Would recommend Karon Beach instead of Patong Beach if you enjoy the beach and not the bars.Even though it's a lot quieter you can still sit at our bar, listen to a band and have a few drinks.",4, March 2020
3147140,"A long beach with not a lot of shade, except back from the sand itself, it is a very pleasant place. Lots of restaurants, bars and shopping nearby, easy to get a taxi, tuk tuk or local bus service (try it!) to Patong or Phuket city from here. When we were here in January 2020 it was packed with Chinese, but mainly Russian tourists. No doubt that has all changed with corona virus. I'm sure there will be many bargains to get tourists back when this finally blows over. It is just such a tragedy that the locals here were only just getting over the 2004 tsunami to be only hit by something almost as devastating all these years later.",4, January 2020
3147143,"You can rent beach chairs which come with an umbrella. Beautiful views, warm blue ocean. Just be prepared for very hot sand froom noon to mid-afternoon. Jetski packages available at the beach",5, March 2020
3147144,"Prefer Karon than patong on the crowds, noise and night life. Morning was nice stroll family friendly and safe. Afternoon gets busy with people sunbath and volleyball plus other water activities. There are shops and restaurants alongside the beach for quick bite and drinks for those who wants to cool down the heat.",5, December 2019
3147145,"This beach is beautiful, clean and safe. When it is not they will fly flags. Also not constantly annoyed by beach sellers, they come show what they have to sell but don't bother you",5, March 2020
3147151,Lots of activities. Many places to eat and drink in the vicinity. Availability of water sports  on the beach . Can spend the entire day and good for walks also.,4, October 2019
3147154,"A lovely beach which is absolutely packed, loads of nearby places to eat and drink. Water sports available.",4, March 2020
3147156,"We didn't stay in Karon town, but we came to this beach 4 times over two weeks.  The sand and water here was the best on this coastline area south of Patong.  Very very clean.  The only better beaches we found we on islands off the coast - Similan being our favourite and then Khai islands beaches second.  Karon would be third - but the most convenient to get too.  Lots available here if you want it - jet skis, parasailing - lots of food just off the beach - plenty of little shops if you need to take a break from the beach for an hour.",5, March 2020
3147157,While the beach is nice and good to walk on especially early morning do be careful if you want to go into the sea. There is a rip tide which can sweep you out to sea. There are several warning about this on the beach and also telling you what to do if you get caught in one so do read the instructions before going into the sea.,3, March 2020
3147158,"We were on holiday with my family in Karon and frequently visited the beach. All sports of activities were available to soend the whole day there. Sunbeds also are available for 200bht for whole day. Eating is easy to arrange just across the road. Beach is clean and well maintained, not toi much disturbance - just relaxin.",4, February 2020
3147161,"Tranquil place. Clean, with umbrellas/ beds available at 200 bhat per day. Some massage food/drinks shacks. Rows of restaurants on the opposite side of the road and shops/small market too to get essentials",4, March 2020
3147162,"The beach in Karon is beautiful in many ways. Clean, tidy and very sandy. The beach is wide so there is plenty of room to lay out a couple of towels if you don't want to hire a sunbed and parasol. The sea is lovely and warm but has a very strong under-currant so beware going out too far. A distinct lack of any toilets of any kind but that seems to be the case on a lot of beaches outside of Europe or the USA. No facilities for washing sand off of your feet etc. A little investment in these facilities would make life a whole lot better for foreign visitors that maybe used to them being in place. The sunsets here are beautiful  don't forget your camera. Overall the beach is fabulous.The main street in Karon is a very vibrant place with lots of bars and eating places (I'll refrain from using the word restaurant) to choose from. Lots of (iced) seafood on display and you can have lots of different foods cooked right in front of you if that's your thing. A few choice smells lingered in the air but nobody seems to bother about them. There is a large market at the top of the road which sells almost every sort of cooked thing you can think of including scorpions and all manner of insects etc. Lots of souvenirs and cheap clothing on offer too. A big stage had been erected when we visited with a variety of Thai entertainment going on. Short trips back to hotels or nearby attractions are easy by taking a ride in a tuk-tuk (with loud disco sounds and lighting if you like). All in all a very entertaining town. If you fancy a busier time, a short trip into Patong will enlighten the senses. Some very nice big shopping malls there. While you're there, a walk along Bangla Road is a must.",4, February 2020
3147163,"Loved Karon beach, was lovely and clean and the water so warm and clear. Rented sun lounges for the day and hardly got hassled by anyone.",5, March 2020
3147164,"Stayed at the Phuket Orchid Spa and Resort.  Great resort, super friendly staff that go out of their way to help.",5, March 2020
3147165,"Nice beach busy lively loads going on, close to town no showers that i saw or toilets, sure they must go in the sea",5, February 2020
3147166,"I was very disappointed in how commercialised Karon Beach/Town was, not what I was expecting at all. Definately not like the photo above.",2, February 2020
3147167,While the beach is nice and good to walk on especially early morning do be careful if you want to go into the sea.   There is a rip tide which can sweep you out to sea.    There are several warning about this on the beach and also telling you what to do if you get caught in one so do read the instructions before going into the sea.,3, March 2020
3147169,"Nice beach to spend your time at. Many places to eat, water activities and volleyball nets. Water is transparent and ideal for swimming since it's so calm.There's also a nice small lake opposite the beach.",5, March 2020
3147175,"Very nice long and wide beach. Sand is powdery soft.  Water is very clear and clean. No rocks,gravel or shells. Lots of lounge chair and umbrellas to rent out  Sunsets are awesome!",5, February 2020
3147178,"One of the lesser crowded beach that is easily accessible. The beach is nice, quiet and good for family.",5, February 2020
3147179,Used to be a beach that was quieter than Patong but has grown a lot and is very busy nowadays and has lost a lot of its charm.,3, February 2020
3147180,"We were staying 6 nights, at the Pacific Club Resort, from 12th to 18th February. Our hotel was about 10 minutes walk from the beachOn our first day here, while out exploring and taking stock of the area, we did walk to the beach.It was such a disappointment, although the beach is situated in a picturesque bay area it was not very pleasant.There were row upon row of sunloungers and umbrellas, virtually touching each other, absolutely no personal space.There were areas of the beach where it was possible to spread beach mats and towels and enjoy the glorious sunshine. There is no shade here.Karon Park runs along the back of the beach, people were spreading out here under the shade of the trees.There was a variety of water sports available on the beach.",3, February 2020
3147188,Long stretch of sandy beach on which all the amenities are available. Snorkelling from rocks at either end can be hit or miss depending on tide height. Boat trips and water sports also available as well as sun loungers (for a price and get there early) and many refreshment vendors on and set back from beach. Sea generally calm although beach  does shelve quickly,5, February 2020
3147191,"After a week in Khao Lak where the beach is beautiful and cared for...no sunbeds, no smoking allowed, Karon Beach was a huge disappointment, very over crowded and the sea didn't seem as clear and clean as Khao Lak..just a personal view but not for me.",2, February 2020
3147196,"Very long clean beach with a good number of sun beds with umbrellas, sea calm and flat when I visited but I know it can be rough at other times of the year",5, February 2020
3147197,"Long stretch of golden sand , beautiful sunsets. Great beach for everyone young or old. Take your own mats or rent one of the many sunbeds",5, February 2020
3147198,Lovely beach with areas of sun beds but need to get up early to get out. Shame it does not have any food outlets. Lovely sunsets,5, February 2020
3147199,Karon Beach is very nice and safe.  There are plenty of activities to pay for (if you wish) and beds and parasols available.,5, January 2020
3147200,"Sand, crystal water, waves -everything like in heaven, only its very crowded. Well, its peak outthere",4, February 2020
3147203,This is a large public beach with plenty shops and restaurants nearby. There are many sunbeds or you can just sit on the sand.The sand makes a unique squishy sound when you walk. The water is clean and warm.,4, February 2020
3147208,"This is a very long beautiful beach, kept clean,plenty of sunbeds. Sand is soft,sea is clean warm and generally calm this time of the year. Loads of beach vendors,but none are pushy. Difficult to find fault of the beach itself.....lots and lots of Russians,but that applies to Karon  in general.Plenty of beach sports, jet ski etc,if that is your thing. Northern end of the beach is quieter,",4, February 2020
3147211,I do love a lovely beach but I'm afraid I wasn't keen on this one. It was very overcrowded and if you didn't get down before 10 beds were full the guys who own the beach beds can be very unfriendly I saw them chase 3 parties away gave them their money back and told them to do one. Knew they could pick and chose who they wanted on the beds.Also heat was unbareable after midday.,3, February 2020
3147212,"Clean beach and water, safe and good for water sport. Good for Families with kids, very nice sunset and the beach is excellent for walk",5, February 2020
3147217,"Spent Christmas Day on this beautiful beach, get there before 11 to make sure you get sun beds together if there are a few of you.",5, December 2019
3147219,"It felt like a snow under the feet, never ever experience anything like that, amazing stones in the end of the beach, so I would recommend to go for them straight from the beginning",5, February 2020
3147221,Karon beach is a good option for swimming but it is crowded and the chairs for some reasons are pushed back away from the beach.If I had to chose between karon and kata. I would kata beach.,4, January 2020
3147225,"This is one of three main beaches in the area.  Its the largest and probably the quieter of them.  The beach is kept clean and tidy although that is a challenge when there are so many people around.  The water is clear, warm and lovely to swim in.  However, there were life guards on view and warning signs indicating the potential for rip tides at certain times of the year.  If your sensible then its a really safe beach.The hotels in the area are generally low rise and spread out along the beach front.  So the visitors are generally spread out so it does nt seem as busy as some resorts you get these days.",4, January 2020
3147226,"I was expecting this beach to be less popular, sadly not, so many people here which was fine but didn't meet my expectations. Perfect for sunset but no restaurants directly in the beach. There are snack huts and massage huts on the beach though",3, February 2020
3147228,This is a beautiful beach and less busy the the Patong Beach. Just dont understand why no sunbeds are allowed here. Its white sand and quite wide and long,4, February 2020
3147237,Great and clean beach. If there would be more bars it would be even more nice. The area between the beach and the road could be cleaned from time to time.,4, January 2020
3147239,Beautiful with white Sandy Beach and clear water .not clear though like phi phi but yes excellent for sun bathing and swimming. Not very crowded but we'll equipped with people and tourists to not bore you. Night market near by beach is also colorful and full of massages centers.,5, December 2019
3147246,A large and long beach but sun beds far too overcrowded. Not much by way of beach bars/restaurants other than in Karon town. Better travelling to Kata beach or Kata Noi beach.,3, January 2020
3147254,Our favourite beach long clean sandy beach shops behind you for drinks and food all the way along ski hire etc also.We use it most days,5, January 2020
3147257,"Karon beach is one of the nicest we found on Phuket Island and although it got pretty busy towards the end of our stay, we were easily able to find available sunbeds a bit down the road. Just don't be lazy to walk for 5mins.",4, January 2020
3147258,"My boyfriend and I spent a lot of time on this beach while on holiday in Phuket. The beach is long and isn't overcrowded. It is walkable from one side to the other and makes a nice day walking along it. The sea is warm and we had fun jumping in the waves. Beach is nice and clean and there are fantastic little beach bars which sell the most amazing fruit shakes, beers and coconuts, perfect to cool down in the heat.",5, December 2019
3147261,Karon Beach is a lovely long sandy beach. It is flat so easy to walk on. It is over 4 KM in length The beach is busy but not super crowded. You can rent 2 lounge chairs with an umbrella for 200 Bhat the chairs are lined up at several locations along the beach A custodian will come by to give you your daily ticket stubThe major tourist group we encountered were Russian but many languages are heard. There are a couple of limited beverage stands along the beach but in many areas if you take a two minute stroll across the street that runs parallel to the beach there are lots of shopsSeadoos paddle boarding and para sailing are all available The beach is very clean,5, January 2020
3147265,"So and so, the beach itself is big but the sand and the water are not the bests ever. Surely the best part is the one on the beginning coming from Patong",3, February 2019
3147272,"Really nice beach to relax. Pristine very fine soft white sand and clear water with turquoise hue sets for the mood. Swim, walk bare foot, enjoy. All you will found around are foreigners here, locals you will see helping you get relaxed with massage offerings by the beach, other services. You have water activities available and snorkelling too on 1 corner",5, December 2019
3147274,"At the right of the beach, just keep walking or get a taxi, hire a bike you can get a typical Thai experience away from the rat race. There is a lovely Thai bar just up from the beach, lovely food etc. Sit there and watch the world go by or go to watch the magnificent sunset.",5, January 2020
3147281,"Perfect beach to spend your days at, soft sand, soft waves to relax in, wide and long beach never feels crowded. The area Karon is full of Russians everywhere everything is translated to Russian sometimes felt like Thai people speak better Russian than English. Food is good there are great places to find cheap food but everything else is overpriced. Gifts clothes etc. Loads of activities like jet ski water sports and parachute.",5, January 2020
3147283,"Beautiful, clean, not ever crowded, warm water.Close to great restaurants and 5 star resorts.I much prefer it over patong",5, January 2020
3147287,Sadly discovered this beach the day before we were leaving.  Highly recommend the beach is stunning and the palm trees in the background absolutely beautiful.  Caught the sunsetting here and the photos look unreal.,5, December 2019
3147290,"Very clean beach, you have to bring your own shade or rent one (if you are lucky to find available)Sandy beach with calm waters, however, current could be strong sometimes (it is open sea after all).Many water sport activities available (banana boat, jet ski, para-sailing, strom) however, a bit pricey. Well worth visiting. Personally I found it less crowded and cleaner than Patong beach (it could also have to do with the fact that i was staying at the Hilton Arcadia which is overlooking the beach).",5, December 2019
3147291,"We read bad reviews for Karon, but we were satisfied. Long and clean beach with hotels, bars and shops, you can rent a sunbed and do watersports (jet skiing, parasailing). You will enjoy it. Finally; you can go there for 40 bath with local (blue) bus.",5, January 2020
3147292,A stunning view with clear blue water and perfect places to swim and snorkel.It is also very clean and has a decent amount of shade.,4, January 2020
3147295,"It was a beautiful beach with clear water to swim and snorkel in, however it was very busy. It is quieter than Patong but busier than Kata.",4, January 2020
3147298,"Our experience on the beach, sitting in chairs or swimming on the water, was mostly good, rip currents aside.  I could have done with fewer people trying to sell us things.  And our experience with parasailing was dangerous and left us injured, so I wouldn't recommend that.",4, December 2019
3147299,"You won't be disappointed with this beach,it's picturesque. Beach umbrellas are available to rent for the day.",5, January 2020
3147303,Big beach. Great water and sand like all beaches on this coastal side of Phuket.We beach hopped on this day and ended up visiting 4 beaches. This was one of them.,4, December 2019
3147305,"Karon beach is very clean, soft sands and very clean water..  there are rentable umbrellas (shades) and sunbeds available. There are also several locals provides water sport activities, only downside they do really annoy other people during  take off or landing parasailing. They do it dangerously for the people who swimming  or sunbathing..",5, January 2020
3147309,"A truly beautiful beach, it's long coast line makes for lots of space so it does feel like you are sitting ontop of other beach goes, not much shade from trees so it's best to bring an umbrella, the waters are usually calm and warm making it a great place to lounge in the ocean.Beautiful and clean, a much nicer beach than patong",4, December 2019
3147311,"Karon beach is a great place for families. The beach is clean and offers some play areas and restaurants near by. Great for families. We stayed at Patong before, but I prefer Karon as it is much cleaner and quieter. There are many hotels and shops near by and it is always easy to find a tuk tuk or a taxi.",4, December 2019
3147317,Beautiful and clean beach where one can sit and enjoy the sunset or just walk around. You can also choose to enjoy the waves or swim in the sea. It is not too crowded which makes it one of the best beaches of Phuket.,5, November 2019
3147329,Love it. Hello from RICCIONE.  I love yojr ospjtality. I come back sure of corse. I lkve you everybody,5, December 2019
3147330,A fantastic and large beach. Very clean for the most part and they have 3 playgrounds for the kids. Across the street are many different restaurants and shops to check out.,5, December 2019
3147333,"Absolutely beautiful beach and while it is less crowded it is also not as accessible to restaurants and shops like in Patong, I prefer Karon over Patong however.",5, November 2019
3147346,"Great beach, white soft sand turquoise clear waters, the waves added some fun.The beach has beach bars to buy drinks and snacks and obviously you have sellers on the beach selling items, however it's quite a lot less sellers than patong beachIt has a toilet and shower block to use for a small charge. Just of the beach is numerous bars shops and restaurants also local taxis and tuktuk service to take you back to your hotel. Visited the beach a few times during our stay as it was so nice. At the seas edge you can see big Buddha in the hills and kata view point over the other islands, its so relaxing and beautiful",5, December 2019
3147350,Lovely walk along the pathway to the beach. The water is perfect and clean. Beware of the under two. Many rent a lounge chair. 200bht for the day. In the evening we loved watching the sun set.,5, February 2019
3147351,The Karon Beach is long with white sandy beach beautiful to walk on but its massive and if you need a good walk thats the place to go.We normally went there in the late afternoon to watch the sunset walking with your feet in the sea water and drink cold fresh coconut juice.,5, November 2019
3147353,"Karon Beach is massive - it takes a long time to walk along it, and on the road there are shops and food areas.  I found the beach had lots of areas where there was nobody there, but other ares had lots of people there.  The sand is good and clean but some people don't always clean up their rubbish.",4, November 2019
3147358,the beach is wide and quite long so nice to walk here during the day with your feet in the sea! Locals do sell you their food etc and some do shout but walk ahead is fine,4, December 2019
3147361,"This location is gorgeous, not as crowded at patong but some locals really lack respect , unlike lost thai people i came across. Either the language gap makes them that way or being purely commercial and wicked. Nyways most people ain't that ways but this guy at the karon beach renting beach chairs needed to be set straight.",3, December 2019
3147365,The beach is clean and long beach. you can find shops on the streets. and its really good for foreigners.,5, January 2019
3147366,"We personally preferred Karon beach over Kata and Patong. It was a bit calmer and less crowded more chilled. On a weekend there's a small market just at the entrance of the beach which makes getting eats and other pretty nice.It's just a personal preference. Whisky there is water sport activities and other going on here, it's still a way better beach to play in as well.",4, November 2019
3147367,more laid back than patongs hustle and bustle. a large stretch of fine sand and clear water. as usual plenty of hawkers selling a large range of goods but the further you walk away from the center the less hassle you get.,5, September 2019
3147370,"Staff very helpful and friendly, we enjoyed our visit The hotel was very central and near the beach We had B&B the breakfast was great, plenty on offerDefinitely would stay again",5, October 2019
3147371,Perfect family destination. Beach is huge and clean. Karon night market is good shopping and eating place. You can also find Indian restaurants around if you are bored with thai food. Tuk tuk here is bit costly and you need to bargain a lot.,5, November 2019
3147373,"Karon Beach was right by the hotel we were staying. The beach was warm and very clear. There is no service from the hotel as the beach is public, but there some locals you can rent an umbrella to get some shade. The beach was in great conditions and we had a great time.PROs: public (free), beautiful beachCONs: no service, need to rent umbrella from locals",5, April 2019
3147375,"couldn't believe  the sand squeaks just like squeaky beach in Australia, one of the best beaches that we found here, crystal clean waters banana chairs umbrellas, shops near when you feel like a nice cold beer from the tap!! ,",5, November 2019
